@context,@type,name,description,image,url
http://schema.org,Thing,Bitsten,"Bitsten, launched in May 2018, is a centralized cryptocurrency exchange based in Indonesia. It supports Indonesian Rupiah (IDR) fiat currency pairs, allowing for cryptocurrency trading against the local currency. Offers typical exchange services such as trading and order matching; may include features like wallet services or market analysis tools.",https://s2.coinmarketcap.com/static/img/exchanges/64x64/636.png,https://exchange.bitsten.com
http://schema.org,Thing,BitStorage,"BitStorage Exchange is a revolutionary cryptocurrency exchange created to provide users with a seamless and secure trading experience. The platform aims to simplify the process of trading cryptocurrencies, making it more accessible and reliable for users of all skill levels. Whether you are an experienced trader or just starting with crypto, the platform offers a user-friendly interface and cutting-edge security features to help trade with confidence.",https://s2.coinmarketcap.com/static/img/exchanges/64x64/585.png,https://bitstorage.finance/
http://schema.org,Thing,BitTrade,"BitTrade, formerly known as Huobi Japan, is a leading Japanese crypto exchange offering the most diverse coin selection in the country. The exchange employs a localization strategy and maintains ties with Huobi Group, utilizing their backend and security systems. It provides both simple swap and order book market services, catering to various user preferences. Operating as a licensed financial instruments business operator in Japan, BitTrade ensures regulatory compliance. It does not issue its own tokens but remains committed to serving the Japanese crypto market effectively through rebranding and growth.",https://s2.coinmarketcap.com/static/img/exchanges/64x64/988.png,https://www.bittrade.co.jp/
http://schema.org,Thing,BitTurk,"BitTurk is a centralized cryptocurrency exchange based in Turkey, launched in September 2017.",https://s2.coinmarketcap.com/static/img/exchanges/64x64/1019.png,https://bitturk.com
http://schema.org,Thing,Bitvavo,"A leading European cryptocurrency exchange based in the Netherlands, offering over 200 digital assets with low trading fees. Founded in 2018, it serves over 1.5 million users. The exchange features staking, recurring buys, and an Account Guarantee program, with access through a mobile app, web, and API. Registered with the Dutch central bank, it prioritizes user security with a diverse team of over 250 members from 35 different nationalities. Supports various payment methods with competitive fees ranging from 0% to 0.25%. Does not offer leverage or margin trading.",https://s2.coinmarketcap.com/static/img/exchanges/64x64/520.png,https://bitvavo.com/en
http://schema.org,Thing,Blockchain.com,"Founded in 2011, Blockchain.com is a pioneering cryptocurrency infrastructure provider offering a blockchain explorer, API, and popular crypto wallet. It has processed over $1 trillion in crypto transactions, with one-third of all Bitcoin network transactions occurring through its platform. The company boasts 37 million verified users and 80 million wallets. Founded by Benjamin Reeves, Nicolas Cary, and Peter Smith, Blockchain.com launched its cryptocurrency exchange in July 2019. Headquartered in London with branches in Lithuania and the US, the platform supports 31 digital assets and offers a tiered fee structure based on trading volume. Margin trading is available for select users, but the service is restricted in several countries due to regulatory constraints.",https://s2.coinmarketcap.com/static/img/exchanges/64x64/1254.png,https://blockchain.com/
http://schema.org,Thing,Blocktrade,"Blocktrade is a gamified crypto exchange offering a unique and engaging user experience. It includes features such as a level-up rewards system, NFT avatars, and leaderboards, which make investing enjoyable. Blocktrade ensures a seamless trading experience by offering zero trading fees, multilingual community support, extensive crypto education resources, and exceptional customer service. Serving as a versatile asset marketplace, it caters to users looking for excitement in their trades or a reliable investment platform. The platform merges financial and gaming elements to create an appealing environment for both novice and seasoned crypto enthusiasts.",https://s2.coinmarketcap.com/static/img/exchanges/64x64/605.png,https://blocktrade.com/
http://schema.org,Thing,BTC-Alpha,"A licensed European cryptocurrency exchange launched in 2016, offering trading services globally. Registered in Lithuania, with offices in Cyprus, Switzerland, and Ukraine. Features a native ERC-20 token, ALP. Provides social listing, API access, and multilingual support. Mobile apps available for Android and iOS.",https://s2.coinmarketcap.com/static/img/exchanges/64x64/228.png,https://btc-alpha.com/
http://schema.org,Thing,BTC Markets,"BTC Markets, launched in July 2013, is a Melbourne-based digital asset exchange. It offers trading pairs in AUD and BTC with tiered fees and free AUD deposits/withdrawals. Features include a trading API, advanced order types, tax reporting, and batch order management. The platform complies with AUSTRAC-regulated AML/CTF legislation under the Anti Money Laundering Counter-Terrorism Financing Act 2018.",https://s2.coinmarketcap.com/static/img/exchanges/64x64/224.png,https://btcmarkets.net/
http://schema.org,Thing,BTCC,"Founded in 2011, BTCC is a long-standing cryptocurrency exchange offering futures trading on over 300 cryptocurrencies with up to 225x leverage. Known for its security, BTCC has had zero incidents since inception and is PCI DSS compliant. With 2.1 million users worldwide, it's accessible globally except in restricted countries. BTCC supports major coins, fan tokens, memecoins, and tokenized futures of commodities and stocks. The platform has a tiered fee structure with maker and taker fees as low as 0% and 0.01% respectively. Higher VIP levels offer discounts and exclusive perks. BTCC aims to make crypto trading reliable and accessible for everyone.",https://s2.coinmarketcap.com/static/img/exchanges/64x64/21.png,https://www.btcc.com/
http://schema.org,Thing,BtcTurk | Kripto,"Launched in 2013, BtcTurk is a centralized exchange based in Istanbul, Turkey. It claims to be the first exchange of its kind in Turkey and the worldâ€™s fourth Bitcoin and cryptocurrency exchange platform. BtcTurk claims to serve more than 5 million registered users and allows Turkish Lira deposits and withdrawals through its integration with seven Turkish banks â€“ this service is available 24 hours a day, seven days a week. BtcTurk currently offers Turkish Lira and USDT pairs. Those signed up to BtcTurk | Kripto can trade with Turkish users, enjoy lower exchange fees and withdraw Bitcoin without any transfer fees.",https://s2.coinmarketcap.com/static/img/exchanges/64x64/243.png,https://kripto.btcturk.com/
http://schema.org,Thing,BTSE,"A digital asset exchange established in 2018, catering to both institutional and retail investors. It offers a variety of services including spot and derivatives trading, an NFT marketplace, OTC trading, asset management, and payment gateways. The exchange supports over 150 cryptocurrencies and 12 fiat currencies without imposing withdrawal limits. Featuring a robust 10-tier VIP fee structure and staking rewards, BTSE provides leveraged trading up to 100x on perpetual futures and 20x on dated futures, along with advanced order types and multi-asset collateral options to enhance trading strategies. Users benefit from cross and isolated wallets, sub-accounts, enhanced risk management features, and strict security protocols backed by an insurance fund.",https://s2.coinmarketcap.com/static/img/exchanges/64x64/658.png,https://www.btse.com/en/home
http://schema.org,Thing,Buda,"Buda.com is an exchange and wallet from Latin-America, with operations in Argentina, Chile (HQ), Colombia and Peru. Buda is reportedly backed by DCG.",https://s2.coinmarketcap.com/static/img/exchanges/64x64/250.png,https://www.buda.com
http://schema.org,Thing,Bunicorn,"Bunicorn is a decentralized exchange on Binance Smart Chain offering innovative features. It provides flexible AMM pools supporting up to 8 tokens with customizable weights, amplified pools for efficient stablecoin swaps, and Liquidity Bootstrapping Pools. The platform employs smart order routing for optimized pricing and dynamic fees based on volatility. Liquidity providers can join multi-token pools with a single asset. Bunicorn's unique high APY yield farming model vests earned rewards as NFT collectibles. These features combine to create a versatile and efficient decentralized trading experience on the Binance Smart Chain.",https://s2.coinmarketcap.com/static/img/exchanges/64x64/1378.png,https://bunicorn.exchange
http://schema.org,Thing,BXH,"BXH is a comprehensive DeFi platform operating on multiple blockchain networks, including BSC, Heco chain, Ethereum, and OKExChain. Its primary focus is on aggregate revenue generation, complemented by a decentralized trading platform. As a one-stop solution, BXH aims to provide users with a range of DeFi services and opportunities within a single ecosystem. The platform's multi-chain approach allows for increased accessibility and potential for cross-chain interactions, catering to a diverse user base across different blockchain networks. By combining revenue aggregation with decentralized trading, BXH offers a versatile DeFi experience that addresses various user needs and preferences in the evolving blockchain landscape.",https://s2.coinmarketcap.com/static/img/exchanges/64x64/1402.png,http://bxh.com/#/
http://schema.org,Thing,Bybit,"Bybit, founded in 2018 by Ben Zhou, is a cryptocurrency centralized exchange offering spot trading, derivatives, NFT marketplace, and other services. It serves over 10 million users globally, except in restricted countries like the U.S. and China. Headquartered in Dubai, Bybit supports 100+ crypto tokens and 300+ trading pairs. The platform uses a tiered fee structure based on a maker-taker model, with non-VIP users paying 0.10% for spot trading and 0.06% (taker) / 0.01% (maker) for derivatives. Bybit offers up to 100X leverage on derivatives products and supports both isolated and cross margin trading.",https://s2.coinmarketcap.com/static/img/exchanges/64x64/521.png,http://www.bybit.com/
http://schema.org,Thing,BYDFi,"A cryptocurrency trading platform established in 2019, offering professional, convenient, and innovative trading services. Their mission is to revolutionize cryptocurrency trading and empower users striving for autonomy and contributing to the cryptocurrency sector's development.",https://s2.coinmarketcap.com/static/img/exchanges/64x64/1188.png,https://www.bydfi.com/
http://schema.org,Thing,C-Patex,"C-Patex is an Argentinian cryptocurrency exchange launched in November 2014. It offers trading for a moderate selection of cryptocurrencies, focusing primarily on well-established digital assets. The platform caters to the Argentine market, providing access to major digital currencies for local users.",https://s2.coinmarketcap.com/static/img/exchanges/64x64/360.png,https://c-patex.com/
http://schema.org,Thing,Capital DEX,"Capital DEX is a decentralized exchange that began operations on December 25, 2020. It is dedicated to security tokens and uses an Automated Market Maker (AMM) algorithm on the Ethereum network to enable ERC-20 token trading. The platform is also focused on developing infrastructure for user KYC procedures to ensure legal protection and safe handling of security tokens.",https://s2.coinmarketcap.com/static/img/exchanges/64x64/1310.png,https://capitaldex.exchange
http://schema.org,Thing,Cat.Ex,"Cat.Ex, founded in August 2018, is a centralized cryptocurrency exchange with a global presence in countries like Brazil, Vietnam, South Korea, Bangladesh, Russia, Turkey, the Middle East, India, Indonesia, and the United States. It features staking, farming, and multiple faucets backed by SNA and microservice-based distributed architecture for efficient horizontal scaling, enhancing performance and reliability for user activity and transaction volumes.",https://s2.coinmarketcap.com/static/img/exchanges/64x64/480.png,https://www.catex.io/
http://schema.org,Thing,CEX.IO,"Established in 2013, a leading cryptocurrency platform focused on global financial inclusion through blockchain technology. It supports digital asset management activities like buying, storing, trading, selling, sending, and earning cryptocurrencies for various clients, including retail, enterprise, and institutional. Known for secure, user-friendly access to decentralized finance, CEX.IO aims at the widespread adoption of digital assets with innovative tools and technologies.",https://s2.coinmarketcap.com/static/img/exchanges/64x64/36.png,https://cex.io
http://schema.org,Thing,Changelly PRO,"Launched on June 7, 2020, as a centralized exchange based in Seychelles. It's a professional upgrade to the Changelly instant swap platform, offering spot and margin trading, along with fiat on-ramp solutions. It serves experienced traders and helps beginners transition to advanced trading practices.",https://s2.coinmarketcap.com/static/img/exchanges/64x64/1128.png,https://pro.changelly.com/market-overview/overview
http://schema.org,Thing,CherrySwap,CherrySwap is an automatic market-making protocol on OKExChain (OEC) that utilizes the Automated Market Maker (AMM) mechanism. ,https://s2.coinmarketcap.com/static/img/exchanges/64x64/1433.png,https://www.cherryswap.net/#/swap
http://schema.org,Thing,Chiliz,"Chiliz.net is the trading platform for all the sports & entertainment tokens partnered with Chiliz ($CHZ) and Socios.com. It includes FC Barcelona, Juventus, Paris Saint-Germain, Galatasaray, AS Roma, OG (esports DOTA2) and many more. Chiliz is a European blockchain-based venture based in Malta with 60+ people. The exchange and trading resources are based in Singapore and across Asia.",https://s2.coinmarketcap.com/static/img/exchanges/64x64/997.png,https://www.chiliz.net/
http://schema.org,Thing,CITEX,"A comprehensive cryptocurrency management platform with various services like spot trading, mining, investment opportunities, incubation services, OTC trading, earning options, and derivatives trading. Focuses on security, convenience, and innovation, providing effective tools for cryptocurrency asset management.",https://s2.coinmarketcap.com/static/img/exchanges/64x64/549.png,https://www.citex.io
http://schema.org,Thing,Clipper (Ethereum),"Clipper is a decentralized exchange (DEX) built for self-made traders instead of hedge funds. Clipper was designed to give traders the best prices anywhere (including fees, slippage and gas) for their small trades (under $10,000) on the pairs they trade the most.",https://s2.coinmarketcap.com/static/img/exchanges/64x64/1462.png,https://clipper.exchange/
http://schema.org,Thing,Coinbase Exchange,"A US-based crypto trading platform founded in 2012 by Brian Armstrong and Fred Ehrsam. It offers buying, selling, and storing of over 150 cryptocurrencies. Transitioning from Coinbase Pro to 'Advanced Trade' on its main app. Available in over 100 countries. Fees range from 0-0.60% based on trading volume. Margin trading was discontinued in 2020 due to regulatory changes.",https://s2.coinmarketcap.com/static/img/exchanges/64x64/89.png,https://exchange.coinbase.com
http://schema.org,Thing,Coincheck,"Coincheck is a Japanese cryptocurrency exchange regulated by Japan's Financial Services Agency, supporting 17 major cryptocurrencies. Founded in 2012 and acquired by Monex Group in 2018, it offers services like OTC trading, IEOs, bill payments with Bitcoin, and an NFT marketplace. Headquartered in Tokyo, it serves over 1.5 million clients, but does not support U.S. investors or offer margin trading.",https://s2.coinmarketcap.com/static/img/exchanges/64x64/106.png,https://coincheck.com/
http://schema.org,Thing,CoinDCX,"An Indian cryptocurrency exchange launched in 2018, known for offering fast fiat-to-crypto conversions with zero fees. It supports diverse crypto products and the highest number of listed cryptocurrencies in India. Notable for rapid onboarding, minimal fees, and instant transactions.",https://s2.coinmarketcap.com/static/img/exchanges/64x64/949.png,https://coindcx.com
http://schema.org,Thing,CoinEx,"CoinEx is a global crypto exchange offering diverse services including spot, futures, and margin trading, AMM, and crypto finance. Founded in 2017 by Haipo Yang, it supports over 600 cryptocurrencies and serves 4 million users in 200+ countries. CoinEx prioritizes user-friendly interfaces, security, and transparency, implementing a ""Merkle Tree"" audit method for Proof of Reserve. The platform offers up to 10X leverage and 110+ futures markets. As part of ViaBTC Group, CoinEx contributes to a comprehensive crypto ecosystem. The CoinEx Ambassador program allows partners to assist in global promotion, offering commissions up to 50% of referees' transaction fees and lifetime rewards for active ambassadors.",https://s2.coinmarketcap.com/static/img/exchanges/64x64/350.png,https://www.coinex.com/
http://schema.org,Thing,CoinJar,"CoinJar, founded in 2013, is a cryptocurrency platform that allows for buying, selling, and spending digital assets. Registered with UK's FCA, the platform has processed billions in transactions and partners with Premier League's Brentford FC and Melbourne Demons. It provides user-friendly mobile apps, professional trading services, and supports instant deposits/withdrawals in AUD and GBP. CoinJar offers competitive fees, starting at 0% for market orders, and supports 30 cryptocurrencies. The CoinJar Card Mastercard enables crypto-to-fiat purchases, and CoinJar Clear offers white-label financial solutions. CoinJar aims to make cryptocurrencies accessible and easy-to-use for everyone.",https://s2.coinmarketcap.com/static/img/exchanges/64x64/657.png,https://www.coinjar.com/
http://schema.org,Thing,Coinlist Pro,"Launched in July 2020 in San Francisco as a centralized exchange. Supports fiat and crypto pairs, including Filecoin at mainnet launch. Offers wBTC/BTC minting/burning and staking for assets like CELO, ALGO, and XTZ. Regulated as a FinCEN-registered Money Services Business, operating as a money transmitter in over 40 US states and internationally.",https://s2.coinmarketcap.com/static/img/exchanges/64x64/1011.png,https://pro.coinlist.co
http://schema.org,Thing,Coinmate,"Coinmate has prioritized reliability, simplicity, and safety in cryptocurrency trading since 2014. The company, known for its transparency, has processed 50 billion CZK in trades, serves over 100,000 clients, with 97% of cryptocurrencies stored in offline wallets. It operates physical offices in Prague and Zlín, Czech Republic, adhering to Czech and EU regulations. Their customer support is available on weekdays, highlighting their commitment to client service and accessibility.",https://s2.coinmarketcap.com/static/img/exchanges/64x64/80.png,https://coinmate.io
http://schema.org,Thing,Coinone,"Coinone is a South Korean crypto exchange founded in 2014 and launched in 2015. It offers trading of over 200 digital assets, focusing on Asian clients. Key features include a user-friendly interface, secure wallet, fiat and crypto deposits, and 24/7 support. The platform provides simplified, professional, and quick trading options, as well as staking. Founded by Myunghun Cha, a cybersecurity expert, Coinone is headquartered in Seoul. The exchange primarily targets South Korean investors, supporting KRW as its only fiat option. Coinone charges a flat fee of 0.2% for the main market, with maker fees ranging from 0-0.1% and taker fees from 0.02-0.1%. Margin trading was removed in 2017 due to regulatory concerns.",https://s2.coinmarketcap.com/static/img/exchanges/64x64/174.png,https://coinone.co.kr/
http://schema.org,Thing,Coinsbit,"An Estonia-based centralized exchange established in August 2018 with a broad user base of 2 million. It offers various services such as cryptocurrency trading, multiple fiat gateways, OTC trading, P2P-lending, and staking. Coinsbit introduced the CNB token in January 2020 to reduce trading fees and supports listings and IEOs. Legally registered as Coinsbit Inc. in Seychelles.",https://s2.coinmarketcap.com/static/img/exchanges/64x64/460.png,https://coinsbit.io/
http://schema.org,Thing,Coinstore,"Established in 2020 as a global crypto asset trading platform focused on high-growth emerging markets. Serves over 5.1 million users in 175 countries with services such as spot and futures trading, Launchpad, earn features, and wallet services. Aims to lead the exchange space in emerging markets by 2025.",https://s2.coinmarketcap.com/static/img/exchanges/64x64/1411.png,https://www.coinstore.com/
http://schema.org,Thing,CoinSwap Space,"CoinSwap Space, launched in April 2021, is a decentralized exchange (DEX) on the Binance Smart Chain using an Automated Market Maker (AMM) model. It facilitates the trading of BEP20 tokens against liquidity pools and enables yield farming. The platform offers smart routing for optimal swaps and allows token staking for additional rewards, alongside providing a low-fee alternative to Ethereum-based exchanges.",https://s2.coinmarketcap.com/static/img/exchanges/64x64/1398.png,https://app.coinswap.space/#/dashboard/pairs
http://schema.org,Thing,CoinTiger,"Launched in 2017, CoinTiger is a Singapore-based centralized exchange supporting CNY transactions. It introduced an equity mechanism with its TigerCash token, allocating 50% of 2018 profits to holders. The platform offers web and mobile applications, with services including trading, IEO voting, and Labs. By mid-2019, it claimed 2 million users across 100 countries. CoinTiger charges 0.15% for takers and 0.08% for makers, employs multiple cybersecurity partners, and provides OTC services for select countries. KYC is optional for most users but required for fiat trading or large withdrawals. API documentation is available for market information and trading.",https://s2.coinmarketcap.com/static/img/exchanges/64x64/391.png,https://www.cointiger.com
http://schema.org,Thing,CoinW,"CoinW is a leading crypto trading platform launched in 2017, known for its security, transparency, and user-centric approach. Based in Dubai, it has expanded to 16 trading centers across 13 countries, serving over 10 million users worldwide. CoinW supports over 1,000 crypto tokens and 500+ trading pairs, including popular coins like BTC, ETH, and XRP. The platform offers leveraged trading up to 200x in Futures and 6x in ETF trading. Basic fees for makers and takers are 0.2%. Founded by experts in crypto, cybersecurity, and finance, CoinW employs over 1,000 professionals from 30 countries, emphasizing global reach and regulatory compliance to advance the crypto industry.",https://s2.coinmarketcap.com/static/img/exchanges/64x64/517.png,https://www.coinw.com/
http://schema.org,Thing,CoinZoom,"A centralized cryptocurrency exchange based in Salt Lake City, Utah, USA. Launched on January 3, 2020, and offers services including fiat currency pairs, deposits, and withdrawals. It is licensed and registered with the Financial Crimes Enforcement Network (FinCEN) as a money services business.",https://s2.coinmarketcap.com/static/img/exchanges/64x64/1029.png,https://www.coinzoom.com
http://schema.org,Thing,Convergence,"Convergence is pioneering as the first Automated Market Maker (AMM) to make private assets interchangeable in DeFi by fractionalizing them through a user-friendly interface. This innovation allows asset owners to tap into DeFi's liquidity, while DeFi users gain access to previously unavailable real-world assets. By combining a lower investment entry barrier with DeFi's liquidity, automation, and transparency, Convergence Finance democratizes access to exotic real-world assets. This platform bridges the gap between traditional finance and DeFi, making private assets more accessible and liquid while expanding investment opportunities for DeFi participants.",https://s2.coinmarketcap.com/static/img/exchanges/64x64/1390.png,https://convx.conv.finance/
http://schema.org,Thing,Crypto.com Exchange,"Launched in 2019, based in Singapore, serving over 50 million customers globally. Offers a mobile app, Visa card, wallet, and NFT services. Supports spot, margin, and derivatives trading with 250+ digital assets, 20 fiat currencies. Tiered fees based on trading volume and CRO staking. Margin trading up to 10X leverage; derivatives up to 100X leverage. Available in most US states and many other countries, with restrictions. Founded by Kris Marszalek on the Crypto.org chain; native token is Cronos (CRO).",https://s2.coinmarketcap.com/static/img/exchanges/64x64/1149.png,https://crypto.com/exchange
http://schema.org,Thing,Cryptonex,"Cryptonex, established in 2017 in the UK, offers a comprehensive suite of cryptocurrency services, including an exchange, p2p platform, multi-currency wallet, and card services. Founded by experienced financial software developers, Cryptonex aims to simplify crypto adoption. The platform employs cold storage for security and supports multiple fiat currencies. Deposits can be made via various methods, with mandatory KYC for fiat transactions. Exchange fees range from 0.1% to 0.01% for VIP users. Cryptonex is accessible via website and mobile apps, and also provides its technologies to other market participants.",https://s2.coinmarketcap.com/static/img/exchanges/64x64/385.png,https://cryptonex.org
