@context,@type,name,description,image,url
http://schema.org,Thing,Currency.com,"A regulated tokenized securities exchange offering a platform for trading cryptocurrencies and over 2000 tokenized assets including stocks, indices, commodities, and FX pairs, tradable with crypto or fiat.",https://s2.coinmarketcap.com/static/img/exchanges/64x64/699.png,https://currency.com/
http://schema.org,Thing,Dcoin,"A global digital asset and derivatives trading platform launched in March 2018. It serves over 3.5 million users across 110+ regions and aims to offer exceptional trading experiences with industry-standard practices, cutting-edge technology, and efficient matching algorithms. Dcoin's focus is on becoming a trusted cryptocurrency trading platform with a strong emphasis on technical excellence and user satisfaction.",https://s2.coinmarketcap.com/static/img/exchanges/64x64/479.png,https://www.dcoin.com/
http://schema.org,Thing,Deepcoin,"A Singapore-based centralized exchange offering spot trading, derivatives, and other financial services. Founded in 2018 by Eagle Huang, it primarily targets the Asian market. Claims to have obtained regulatory licenses in the US and Canada. Supports 216 trading pairs, including popular cryptocurrencies and fiat currencies. Headquartered in Singapore with branches in several countries. Restricts users from certain jurisdictions, including the US and Hong Kong. Offers competitive fees, with spot trading currently free. Margin trading available with up to 125x leverage. Provides innovative products like Super Saving and Lucky Money.",https://s2.coinmarketcap.com/static/img/exchanges/64x64/1182.png,https://www.deepcoin.com/cmc
http://schema.org,Thing,DeFiChain DEX,"DeFiChain DEX is an audited, decentralized exchange launched in November 2020. It offers swaps between DFI, BTC, ETH, and USDT with yields over 300% APY. Uses Bitcoin's blockchain for security. No vulnerabilities found by SlowMist and KnownSec audits.",https://s2.coinmarketcap.com/static/img/exchanges/64x64/1235.png,https://defiscan.live/dex
http://schema.org,Thing,Delta Exchange,"Delta Exchange, founded in 2018, is a crypto derivatives platform offering Futures, Perpetual Swaps, and Options on Bitcoin and over 50 Altcoins with up to 100x leverage. Backed by notable investors, Delta provides innovative products like Calendar Spreads and Interest Rate Swaps. The exchange boasts cheap volatility and tight spreads in Options, featuring unique offerings such as Straddles and Turbo Options on various cryptocurrencies. Delta aims to deliver an optimal trading experience through its robust engine and diverse product range. Traders can access Futures and Options markets via provided links. For community engagement, Delta maintains active Telegram and Twitter channels.",https://s2.coinmarketcap.com/static/img/exchanges/64x64/705.png,https://www.delta.exchange/
http://schema.org,Thing,Deribit,"Launched in June 2016, is a cryptocurrency trading platform specializing in futures and options. Based in Amsterdam, the company offers advanced trading services for digital assets, focusing on derivatives products. As a specialized platform, it caters to more experienced traders seeking sophisticated financial instruments in the crypto market. The platform's emphasis on futures and options sets it apart from many other cryptocurrency exchanges, which primarily offer spot trading. Its location in Amsterdam positions it within the European financial ecosystem, potentially influencing its regulatory approach and market focus.",https://s2.coinmarketcap.com/static/img/exchanges/64x64/522.png,https://www.deribit.com/
http://schema.org,Thing,Dex-Trade,"Founded in 2017 and registered in Belize, Dex-Trade is a centralized cryptocurrency exchange. It offers safe trading with low commissions, catering to both novice and expert traders. The platform provides high liquidity, minimal spreads, a demo mode for strategy testing, and 24/7 customer support. Dex-Trade also offers listing and promotion services, leveraging market-making tools and is headquartered in Belize City, Belize. Mobile apps are available for Android and iOS devices.",https://s2.coinmarketcap.com/static/img/exchanges/64x64/154.png,https://dex-trade.com/
http://schema.org,Thing,Dfyn Network,"Dfyn is a Layer-2 AMM is a permissionless decentralized exchange (DEX) based on Ethereum, powered by Matic Networkâ€™s Layer 2 scalability infrastructure. By utilizing Layer 2 for transactions, Dfyn users will be able to trade any ERC20 asset at lightning-fast speeds with near-zero gas costs.",https://s2.coinmarketcap.com/static/img/exchanges/64x64/1304.png,https://exchange.dfyn.network/
http://schema.org,Thing,DigiFinex,"DigiFinex, founded in 2017 and headquartered in Singapore, is a global digital currency trading platform. It offers trading in mainstream and smaller cryptocurrencies with services like leveraged trading, OTC trading, and asset custody. Features include margin trading up to 5X leverage and perpetual contracts up to 100X leverage. Known for strong security measures and KYC processes, it has no reported hacks. Despite restrictions in some countries like the US and China, it recently launched a service for Canadian users.",https://s2.coinmarketcap.com/static/img/exchanges/64x64/407.png,https://www.digifinex.com/
http://schema.org,Thing,digitalexchange.id,"A centralized crypto exchange platform based in Indonesia. Established in 2018 and launched in 2019, it aims to become the largest Indonesian crypto exchange supporting IDR trading pairs. Officially registered with BAPPEBTI and KOMINFO, it offers over 60 crypto assets as of May 2023, accessible via mobile apps on Google Play and App Store.",https://s2.coinmarketcap.com/static/img/exchanges/64x64/802.png,https://digitalexchange.id/market
http://schema.org,Thing,dYdX,"dYdX is a leading non-custodial decentralized exchange (DEX) focused on advanced crypto derivatives, particularly perpetuals. It launched its native token, $DYDX, in August 2021 for governance and trader rewards. Utilizing StarkWare's StarkEx scalability engine, the platform operates on a layer 2 protocol for efficiency. Headquartered in San Francisco, with a foundation in Zug, Switzerland, dYdX supports popular trading pairs like Ethereum, Bitcoin, and Solana. Features include a maker-taker fee structure and leveraged trading up to 20X for BTC and ETH markets. Plans are in motion to launch an independent blockchain based on Cosmos SDK.",https://s2.coinmarketcap.com/static/img/exchanges/64x64/516.png,https://trade.dydx.exchange/
http://schema.org,Thing,Ecxx,"A centralized cryptocurrency exchange founded in Singapore in March 2019. Known for being the only exchange in Singapore with access to MyInfo, the national identity database, it aims to become a fully regulated and licensed platform. Its focus on regulatory compliance and privileged access to official identity data enhances its capability to streamline user verification processes, positioning it as a trustworthy and secure trading platform.",https://s2.coinmarketcap.com/static/img/exchanges/64x64/629.png,https://www.ecxx.com/
http://schema.org,Thing,Emirex,"A pioneering platform combining an exchange and marketplace for digital assets. It is based in Estonia with operations in the Czech Republic and Lithuania, serving investors and issuers in the Middle East, Africa, Asia, and Europe.",https://s2.coinmarketcap.com/static/img/exchanges/64x64/731.png,http://emirex.com/
http://schema.org,Thing,Energiswap,"A pioneering decentralized exchange and crypto swap protocol built on the Energi Blockchain. It focuses on improving security, reducing transaction costs, and enhancing user experience within the decentralized exchange landscape.",https://s2.coinmarketcap.com/static/img/exchanges/64x64/1307.png,https://energiswap.exchange/
http://schema.org,Thing,EXMO,"A British cryptocurrency exchange with approximately 2.5 million users. Supports over six fiat currencies, including USD and EUR, and offers payment methods such as SEPA, SWIFT, and credit/debit cards. Headquartered in London, with offices in Poland, Ukraine, Lithuania, and the US. The company employs a project team of over 150 people, indicating a strong market presence and service diversity.",https://s2.coinmarketcap.com/static/img/exchanges/64x64/50.png,https://exmo.com/
http://schema.org,Thing,FameEX,"FameEX is a global derivatives trading platform founded in 2018 by Lee BoonGin. The platform offers spot, grid, margin, futures, and options trading for cryptocurrencies. It includes features such as AI-recommended order placement, online futures calculators, and grid trading bots.",https://s2.coinmarketcap.com/static/img/exchanges/64x64/1247.png,https://www.fameex.com/en-US/
http://schema.org,Thing,Felixo,"Felixo is a centralized cryptocurrency exchange launched in October 2018 and based in Turkey. It offers trading pairs with the Turkish Lira (TRY), facilitating the exchange of digital assets using the local fiat currency. The platform manages user funds and transactions through a centralized entity, serving primarily the Turkish market.",https://s2.coinmarketcap.com/static/img/exchanges/64x64/1012.png,https://www.felixo.com/
http://schema.org,Thing,Finexbox,"Finexbox is a centralized cryptocurrency exchange based in Hong Kong, launched in October 2018. It is described as a comprehensive spot trading platform for digital assets. The exchange offers leveraged margin trading with up to 3.3x leverage through a peer-to-peer funding market. This feature is intended to amplify gains for traders, though it also increases risk. The platform includes a variety of tools and services tailored for both novice and experienced traders in the cryptocurrency market.",https://s2.coinmarketcap.com/static/img/exchanges/64x64/514.png,https://www.finexbox.com/
http://schema.org,Thing,Flybit,"Flybit, launched on March 15, 2019, is a centralized cryptocurrency exchange headquartered in Seoul, Korea. It allows for deposits and withdrawals in Korean Won (KRW) and cryptocurrencies. The platform is designed for user-friendliness with enhanced security measures and higher liquidity. Supporting KRW transactions, it is especially accessible to Korean users and those interested in trading in Korean currency.",https://s2.coinmarketcap.com/static/img/exchanges/64x64/1037.png,https://flybit.com/
http://schema.org,Thing,FOBLGATE,"FOBLGATE, launched in July 2019, is a centralized cryptocurrency exchange headquartered in Seoul, South Korea. Its specific address is 5F, 597, Gangnam-daero, Seocho-gu. As a centralized exchange, FOBLGATE likely offers a range of trading services for various digital assets, providing a platform for users to buy, sell, and trade cryptocurrencies. The exchange operates under South Korean regulations and caters to both domestic and international users interested in participating in the cryptocurrency market.",https://s2.coinmarketcap.com/static/img/exchanges/64x64/644.png,https://www.foblgate.com/
http://schema.org,Thing,Foxbit,Foxbit is a São Paulo-based bitcoin and cryptocurrency company with a mission to revolutionize the financial market.,https://s2.coinmarketcap.com/static/img/exchanges/64x64/1215.png,https://foxbit.com.br/grafico-bitcoin/
http://schema.org,Thing,Gate.io,"Gate.io is a centralized cryptocurrency exchange launched in 2013. It supports trading for over 1400 cryptocurrencies across 2500+ pairs, including spot, margin, options, futures, and derivatives trading. The platform reports a daily trading volume exceeding $12 billion and offers a range of services with features like a mobile app and 24/7 support. Founded by Lin Han in China, it is now based in the Cayman Islands and available globally with certain restrictions. A KYC process is mandatory for transaction activities, and the exchange maintains competitive fees. Margin trading provides up to 10X leverage, and the exchange incorporates a tiered VIP system for trading fees, although it lacks regulation and fiat withdrawal capability.",https://s2.coinmarketcap.com/static/img/exchanges/64x64/302.png,https://gate.io/
http://schema.org,Thing,Gemini,"A regulated cryptocurrency exchange available in over 60 countries, offering 80+ cryptocurrencies and 21+ trading pairs. Founded by Tyler and Cameron Winklevoss in 2015. It caters to both beginners and advanced traders with a focus on security and compliance.",https://s2.coinmarketcap.com/static/img/exchanges/64x64/151.png,https://www.gemini.com/
http://schema.org,Thing,Giottus,"Giottus is revolutionizing digital asset trading in India with a customer-centric platform. It offers high ratings, a proprietary order processing engine, insurance protection, fast KYC processing, 24/7 banking support, multilingual customer service, trading in 100+ cryptocurrency pairs, a highly liquid spot exchange focusing on INR pairs, and a one-click buy option.",https://s2.coinmarketcap.com/static/img/exchanges/64x64/1009.png,https://www.giottus.com/tradeview
http://schema.org,Thing,Globe Derivative Exchange,"As a second-generation cryptocurrency derivatives exchange, Globe has had time to learn from the missteps of the previous generation Globe has a unique exchange architecture to tackle this - Matching and risk engines run in colocation on high frequency trading hardware - This allows for the entire orderbook to be kept in L3 cache at all times and nanosecond latencies between services yielding faster-than-NASDAQ message processing rates to avoid overloads - Globe also benefits from the huge expense invested into fast connections between major financial data centers like London (LD4) and Tokyo, meaning that Globe can offer superior global lag characteristics and throughput to previous generation exchanges",https://s2.coinmarketcap.com/static/img/exchanges/64x64/1371.png,https://globe.exchange/
http://schema.org,Thing,Hanbitco,"A regulation-ready Korean exchange launched in 2018. It has notable certifications and rankings for cybersecurity. Founding member of the Korea Blockchain Association (KBA). Played a significant role in shaping self-regulatory requirements for Korean exchanges. CEOs held leadership positions within the KBA Exchange Committee. Initiated the ChainAction social movement in 2018, focusing on aligning blockchain projects with UN Sustainable Development Goals and promoting cryptocurrency adoption. Demonstrates commitment to regulatory compliance, industry leadership, and social responsibility in the blockchain ecosystem.",https://s2.coinmarketcap.com/static/img/exchanges/64x64/483.png,https://www.hanbitco.com/
http://schema.org,Thing,HashKey Exchange,"Hong Kong's first licensed retail virtual asset exchange, focusing on compliance, safety, and security. Offers fiat-to-crypto trading, segregated client funds, and custody-grade insurance. ISO 27001 and ISO 27701 certified.",https://s2.coinmarketcap.com/static/img/exchanges/64x64/795.png,https://www.hashkey.com/
http://schema.org,Thing,HitBTC,"HitBTC, established in 2013, is a global cryptocurrency exchange offering over 800 trading pairs and various services. It provides multiple APIs and a sophisticated UI for advanced traders, along with a tiered fee system. Security measures include cold storage, encryption, 2-factor authentication, and whitelists. The platform has improved its technical capabilities and reduced latency. HitBTC serves both individual and corporate clients, with offices in major cities worldwide. The exchange offers exchange, custodial, and related services, catering to demanding traders while prioritizing user security and platform efficiency.",https://s2.coinmarketcap.com/static/img/exchanges/64x64/42.png,https://hitbtc.com
http://schema.org,Thing,Honeyswap,"Honeyswap is a decentralized exchange (DEX) on the xDai chain, replicating UniSwap V2. It uses an automated market maker model and is governed by the 1hive community using the HNY token. Liquidity providers can deposit tokens and receive LP tokens. The exchange supports token swaps, flash loans, and oracles. Users must bridge ERC-20 tokens from Ethereum to xDai. Launched in September 2020, Honeyswap is managed by a decentralized autonomous organization (DAO) with no central location. While there are no formal restrictions, users from US-sanctioned countries may face limitations. The exchange supports ERC-20 tokens and charges a 0.3% fee for swaps. Leverage and margin trading are not available.",https://s2.coinmarketcap.com/static/img/exchanges/64x64/1190.png,https://app.honeyswap.org/#/swap
http://schema.org,Thing,HTX,"HTX is a comprehensive blockchain ecosystem offering digital asset trading, financial derivatives, wallets, research, investments, and incubation services. It supports spot, futures, and margin trading with earn products, custody services, and trading bots. Founded by Leon Li in 2013 as Huobi Global, it rebranded to HTX in 2022.",https://s2.coinmarketcap.com/static/img/exchanges/64x64/102.png,https://www.htx.com/en-us/
http://schema.org,Thing,IDEX,"IDEX is a decentralized exchange combining the best of traditional order books and automated market makers. This hybrid system uses on-chain settlement and off-chain trading to minimize failed trades and reduce gas fees. IDEX safeguards against front-running and sandwich attacks while enabling advanced order types and arbitrage opportunities. Liquidity is provided by both AMM and user limit orders. Smart contracts are employed to decentralize custody and settlement, enhancing fund security. Founded by Alex and Phil Wearn in 2017, the company operates out of Panama and adheres to legal regulations. IDEX supports a wide range of major cryptocurrencies and ERC-20 tokens, implementing a 0.25% taker fee, with future plans to introduce leverage trading.",https://s2.coinmarketcap.com/static/img/exchanges/64x64/310.png,https://idex.io
http://schema.org,Thing,Independent Reserve,"Independent Reserve, launched in October 2013, is a Sydney-based centralized exchange. It supports AUD, NZD, and USD pairs. As a platform regulated by AUSTRAC, it focuses on serving users primarily from Australia, New Zealand, and Singapore while expanding to over 30 countries. In January 2020, Independent Reserve made a strategic expansion to Singapore to seek MAS licensing. Known for its emphasis on regulation, trust, and security, the exchange has offered insurance coverage for digital assets since February 2019. Notable features include a KPMG tax calculator, auto trading options, Bloomberg price feeds, and an API for automated trading. Services cater to individuals, businesses, trusts, and Self-Managed Super Funds (SMSFs), with a mandatory Know Your Customer (KYC) policy and a system of tiered trading fees. The company strives to maintain a reputation as a trusted and secure platform for cryptocurrency trading within its target markets.",https://s2.coinmarketcap.com/static/img/exchanges/64x64/166.png,https://www.independentreserve.com/
http://schema.org,Thing,Indodax,"Indonesia's largest digital asset marketplace with over 64 coins and 75 trading pairs. More than 2 million registered members as of November 2019. Offers user-friendly features to purchase digital assets with IDR within an hour. Registered with BAPPEBTI under number 002/BAPPEBTI/CP-AK/01/2020, complying with Indonesia's cryptocurrency market regulations.",https://s2.coinmarketcap.com/static/img/exchanges/64x64/68.png,https://indodax.com/
http://schema.org,Thing,IndoEx,"Launched on January 16, 2019, this decentralized exchange caters to experienced traders, professionals, and institutions, aiming to provide the safest and fastest digital asset exchange. It operates from Estonia and the UK, supporting EUR/USD fiat pairs.",https://s2.coinmarketcap.com/static/img/exchanges/64x64/587.png,https://www.indoex.io/
http://schema.org,Thing,Jetswap (BSC),"Founded in 2021, Jetswap is a decentralized Automated Market Maker serving Binance Smart Chain and Polygon Network. As a decentralized exchange, there are no limits or boundaries for the service area of Jetswap. Anybody with a Binance Smart Chain or Polygon Network wallet can use Jetswap to trade up to 30 asset pairs on Binance Smart Chain and 25 asset pairs on Polygon Network against a liquidity pool. Users can deposit liquidity and earn trading fees from trading volume. Additionally, Jetswap users can earn WINGS by depositing LP tokens. WINGS can be used as a liquidity incentive, governance rights, fundraising, lotteries, and NFT purchases.",https://s2.coinmarketcap.com/static/img/exchanges/64x64/1457.png,https://info.jetswap.finance/home
http://schema.org,Thing,Jswap Finance,"Jswap Finance is a decentralized exchange and financial management protocol offering comprehensive DeFi services. Its governance token, JF, has a total supply of 100 million, with all platform profits used for token buybacks and burns. The protocol features various functions, including token exchange, fund pooling, LP farming, aggregate financial management, cross-chain bridging, and IDO capabilities. Jswap Finance aims to provide users with a one-stop solution for their decentralized finance needs, integrating multiple DeFi services into a single platform.",https://s2.coinmarketcap.com/static/img/exchanges/64x64/1476.png,https://app.jswap.finance/#/swap
http://schema.org,Thing,Jubi,"Founded in 2013, Jubi.com is one of the earliest trading service platforms in the world. In 2017, its trading volume once ranked first in the world. In March 2020, it obtained the MAS exemption from the Monetary Authority of Singapore. On January 31, 2024, the Jubi trading platform was fully acquired by Exor Digital Holdings Limited and officially upgraded and renamed the JuCoin digital asset trading platform. The JuCoin digital asset trading platform will comprehensively upgrade the brand, technology, ecological development, user services, channel expansion, AI artificial intelligence data services and other sectors, focusing on the development of BTC ecosystem, DeFi infrastructure, Web 3.0 digital entity industry track, etc.",https://s2.coinmarketcap.com/static/img/exchanges/64x64/1006.png,https://www.jbex.com/exchange
http://schema.org,Thing,JulSwap,"JulSwap, formerly SwapLiquidity, is a Binance Smart Chain-based decentralized exchange similar to Uniswap. It offers the same trading engine and analytics as Uniswap, plus features from Sushiswap. JulSwap provides faster and cheaper transactions, supported by the JustLiquidity Protocol. Users can stake JULb tokens and benefit from cross-chain functionality with a Token Bridge between ERC20 and BEP20 tokens. This allows users to operate on both Ethereum and Binance Smart Chain networks, enhancing flexibility and accessibility for traders and liquidity providers.",https://s2.coinmarketcap.com/static/img/exchanges/64x64/1196.png,https://julswap.com
http://schema.org,Thing,Sunswap v2,"Sun is a DEX ecosystem on the Tron blockchain. The DEX leverages several transaction protocols and provides various incentives for traders to use the exchange, such as yield farming and staking rewards. The exchange integrates functions like token swapsand stablecoin swaps, and has a burn mechanism for its native utility token",https://s2.coinmarketcap.com/static/img/exchanges/64x64/1116.png,https://sunswap.com/#/v2
http://schema.org,Thing,Kava Swap,"Kava Swap is a cross-chain Autonomous Market Making (AMM) application built on the Kava Platform, offering users enhanced earning opportunities through crypto asset swapping and liquidity provision. It leverages Kava's DeFi infrastructure, cross-chain bridges, and security to provide a seamless and safe experience. Users can swap major crypto assets, deploy capital into market-making pools, and earn native yields and $SWP rewards.",https://s2.coinmarketcap.com/static/img/exchanges/64x64/1454.png,https://app.kava.io/swap/
http://schema.org,Thing,Kine Protocol,"Kine Protocol is a peer-to-pool derivative market offering zero-slippage execution, guaranteed liquidity, and up to 100x leverage with cross margin. Users can participate as stakers, traders, or liquidators. Founded by Lei Wang in March 2021, it supports trading of perpetual contracts for major cryptocurrencies on multiple chains. The protocol charges a 0.1% trading fee and allows leverage up to 100x, with individual position limits. Kine Protocol received $7 million in funding in March 2021 and a strategic investment from AVATAR in December 2021. Based in Singapore, the company has not disclosed specific country restrictions for usage.",https://s2.coinmarketcap.com/static/img/exchanges/64x64/1414.png,https://www.kine.io
http://schema.org,Thing,KLAYswap,"A decentralized, on-chain instant swap protocol launched in January 2021. It features an automated market maker-powered liquidity pool, allowing users to become liquidity providers and earn transaction fees. Supports token swaps between Ethereum and the Klaytn ecosystem via the Orbit Bridge. Users can provide liquidity by matching KLAY-KCT pairs and receive LP tokens. The KSP governance token enables participation in improvement proposals and pool creation. Attracts long-term investors, income-seeking traders, and miners. Charges a 0.3% fee for token swaps; does not offer leverage or margin trading. Supports all KCT-standard tokens with no specific location or restricted countries.",https://s2.coinmarketcap.com/static/img/exchanges/64x64/1232.png,https://klayswap.com/dashboard
