@context,@type,name,description,image,url
http://schema.org,Thing,P2B,"P2B is a highly-regarded European cryptocurrency exchange, placed in the global TOP-20 by CoinMarketCap. Known for trustworthiness, liquidity, and security, P2B has over 6 years of experience with more than 2,000 crypto project launches and a range of expert promotion services. It is a popular choice for new projects due to its supportive onboarding process and expertise. The advanced launchpad platform has conducted 350 successful events, collectively raising over $10 million. P2B actively contributes to the development of Web 3.0 via its Fund for Rising Stars, offering robust community and professional support.",https://s2.coinmarketcap.com/static/img/exchanges/64x64/215.png,https://p2pb2b.com/
http://schema.org,Thing,PancakeSwap,A decentralized exchange on Binance Smart Chain for BEP20 token swaps using an automated market maker model with liquidity pools.,https://s2.coinmarketcap.com/static/img/exchanges/64x64/1165.png,https://pancakeswap.finance/
http://schema.org,Thing,PancakeSwap v2 (BSC),"PancakeSwap is a decentralized finance platform allowing users to trade cryptocurrencies, earn rewards through staking and farming, participate in lotteries, and vote in governance decisions. It operates on the Binance Smart Chain, focusing on low fees and fast transactions. ",https://s2.coinmarketcap.com/static/img/exchanges/64x64/1344.png,https://pancakeswap.finance/
http://schema.org,Thing,Pangolin,"Pangolin is a community-driven decentralized exchange (DEX) that operates on both Avalanche and Ethereum networks. It is known for fast settlement times, low transaction fees, and a democratic distribution model. The platform utilizes Avalanche's technology to enhance trading opportunities and aims to maximize user yield. It is designed to address efficiency, cost-effectiveness, and user empowerment, making it a competitive choice for those involved in cross-chain asset exchanges and yield optimization.",https://s2.coinmarketcap.com/static/img/exchanges/64x64/1340.png,https://app.pangolin.exchange/#/swap
http://schema.org,Thing,Paribu,"Founded in Istanbul in 2017, Paribu is a prominent cryptocurrency trading platform with nearly 5 million users. It supports over 60 cryptocurrencies and offers Turkish Lira and USDT pairs. The exchange integrates with seven banks, allowing users to deposit and withdraw Turkish Lira. Paribu provides 24/7 customer support and has become a leading player in the Turkish cryptocurrency market since its inception.",https://s2.coinmarketcap.com/static/img/exchanges/64x64/225.png,https://www.paribu.com/
http://schema.org,Thing,Phemex,"Phemex is a Singapore-based crypto derivatives trading exchange launched in 2019 by former Morgan Stanley executives. It offers low fees, deep liquidity, and user-friendly features for spot, contract, and margin trading. The platform supports over 250 assets and can handle 300,000 transactions per second. Phemex serves clients from beginners to professionals, providing financial advice, educational resources, and a mobile app. The exchange is available in 200+ countries but restricted in several regions, including the US and UK. Phemex charges a 0.1% spot fee and uses a Maker-Taker model for contract trading. Users can trade with up to 100x leverage on perpetual contracts.",https://s2.coinmarketcap.com/static/img/exchanges/64x64/955.png,https://phemex.com/
http://schema.org,Thing,Pionex,"Launched in 2019 and headquartered in Singapore, Pionex is a leading cryptocurrency exchange offering automated trading bots and a fast matching engine. It supports over 430 cryptocurrencies and 500 trading pairs, including major tokens like BTC, ETH, and BNB. The platform offers various quantitative trading robots, including Grid Trading and Perpetual Futures robots, and ensures a 100% cryptocurrency storage reserve with transparent asset management through regular Merkle tree updates. Trading fees are 0.05% for both market taker and maker, aiming to establish a win-win relationship with users by offering valuable trading tools and services on a secure platform.",https://s2.coinmarketcap.com/static/img/exchanges/64x64/790.png,https://www.pionex.com/
http://schema.org,Thing,PlasmaSwap (Ethereum),"PlasmaSwap is an advanced protocol for automated token exchange on Ethereum. The protocol has a professional UI for traders and liquidity providers, limit orders, advanced analytics tools, and gas optimization features for users.",https://s2.coinmarketcap.com/static/img/exchanges/64x64/1325.png,https://apy.plasma.finance/#/liquidity-pools
http://schema.org,Thing,PointPay,"PointPay is a centralized cryptocurrency exchange established in 2018, serving over 1 million users worldwide. It provides a cohesive ecosystem including a bank, exchange platform, and payment system based on blockchain technology. Users are offered three trading interfaces namely Classic, Advanced, and Quick Exchange. Operating globally, its headquarters is in St. Vincent and the Grenadines with offices in Turkey, Lithuania, and the USA. The exchange supports several cryptocurrencies such as BTC, ETH, and USDT. It implements a maker-taker fee structure of 0.05%, offering discounts to PointPay token holders. Deposits and internal transfers incur no fees. Trading is restricted for users from countries under US sanctions.",https://s2.coinmarketcap.com/static/img/exchanges/64x64/1199.png,https://exchange.pointpay.io/
http://schema.org,Thing,Polkaswap,"Polkaswap is a non-custodial, automated market maker (AMM) decentralized exchange (DEX) specifically created for the Polkadot ecosystem. It offers a seamless platform for immediate asset exchanges, prioritizing liquidity, security, and user convenience. The exchange features a user-friendly interface to enhance the trading experience. Polkaswap's design caters to the unique needs of the Polkadot network, providing a specialized solution for users within this ecosystem.",https://s2.coinmarketcap.com/static/img/exchanges/64x64/1101.png,https://polkaswap.io/
http://schema.org,Thing,Poloniex,"Poloniex is a global crypto centralized exchange offering spot and margin trading, futures, perpetual swaps, limit orders, P2P lending, staking, and a trading terminal. Founded in 2014 by Tristan D'Agosta, it lists over 350 cryptocurrencies and supports various payment methods. The platform charges fees based on a maker-taker model, with discounts for high-volume traders. Poloniex offers margin trading with up to 2.5X leverage and futures trading with up to 100X leverage. The exchange is backed by Justin Sun and is not available in the United States and some other countries. Poloniex provides an insurance fund and educational resources through its Poloniex Learn community.",https://s2.coinmarketcap.com/static/img/exchanges/64x64/16.png,https://poloniex.com
http://schema.org,Thing,PolyDEX,"A component of the Cryption Network offering attractive APRs to liquidity providers, gasless transactions, cross-chain bridges, and high scalability for decentralized exchanges on the Polygon network.",https://s2.coinmarketcap.com/static/img/exchanges/64x64/1444.png,https://app.polydex.org/
http://schema.org,Thing,Polyx,"Polyx is a centralized exchange launched in November 2018 and based in Estonia. It offers trading pairs with USD, EUR, and RUB fiat currencies. The platform provides a centralized trading environment for cryptocurrency users.",https://s2.coinmarketcap.com/static/img/exchanges/64x64/498.png,https://polyx.net
http://schema.org,Thing,PrimeXBT,"PrimeXBT is a centralized cryptocurrency exchange launched in 2018. It offers over 100 assets across Crypto, Forex, Commodities, and Indices markets. The platform provides derivative trading instruments, Copy Trading, and multi-asset accounts. Registered in Seychelles, PrimeXBT serves clients in over 150 countries, excluding the U.S., Canada, and certain others. It supports major cryptocurrencies and traditional financial markets. Competitive fees are offered with maker/taker fees at 0.01%/0.02% for Crypto Futures and 0.05% for Crypto CFDs. High leverage trading of up to 1000X for CFDs and 200X for Crypto Futures/CFDs is available, with advanced trading tools powered by TradingView.",https://s2.coinmarketcap.com/static/img/exchanges/64x64/1110.png,https://primexbt.com/
http://schema.org,Thing,ProBit Global,"Probit Exchange (www.probit.com) describes itself as a global coin-to-coin cryptocurrency exchange. ProBit Exchange only lists what it deems to be 'qualified and deserving' cryptocurrency projects. ProBit Exchange reportedly has an order matching speed of over 1.5 million orders per second and a customizable user interface. In addition, ProBit Exchange claims to provide users with the option of a hardware security key in addition to 2 Factor Authentication.",https://s2.coinmarketcap.com/static/img/exchanges/64x64/477.png,https://www.probit.com/en-us/
http://schema.org,Thing,QuickSwap,"QuickSwap is a decentralized exchange (DEX) on the Polygon Network, offering faster and cheaper transactions than Ethereum-based exchanges. It employs an automated market maker with upgradeable smart contracts, eliminating intermediaries. The platform emphasizes decentralization, censorship resistance, and security. It enables users to become liquidity providers by depositing tokens into pools for ERC-20 token trading. QuickSwap was founded by Roc Zacharias and launched in May 2021, with 96% of tokens distributed to the community. It supports all ERC-20 tokens on Polygon and imposes a 0.3% fee for swaps, which is distributed to liquidity providers. The exchange doesn't support leverage or margin trading.",https://s2.coinmarketcap.com/static/img/exchanges/64x64/1293.png,https://quickswap.exchange/
http://schema.org,Thing,Quidax,"An African-focused global cryptocurrency exchange enabling users to trade crypto with local currencies (NGN, GHS, ZAR) and other cryptocurrencies. It operates primarily as a spot exchange and offers competitive fees: 0.10% for makers and 0.3% for takers on regular trades. Instant Buy and Sell fees range from 1% to 2%.",https://s2.coinmarketcap.com/static/img/exchanges/64x64/1336.png,https://www.quidax.com/
http://schema.org,Thing,Raydium,"Raydium is a decentralized exchange based on the Solana blockchain. It utilizes an automated market maker model, allowing for efficient token swaps, trading, and liquidity provision. It integrates with Serum, enabling users to access a wide range of liquidity and order flow. Key features include a best price swap option and permissionless liquidity pools. The platform's native RAY token can be staked for governance. Raydium, created by the team AlphaRay, XRay, and GammaRay, officially launched on February 21, 2022. It supports all Solana-based SPL tokens and imposes a 0.25% fee on token swaps. The service does not offer leverage or margin trading and is inaccessible in certain regions, including the US.",https://s2.coinmarketcap.com/static/img/exchanges/64x64/1342.png,https://raydium.io/
http://schema.org,Thing,Reku,"Reku is a regulated Indonesian crypto exchange established in 2018, licensed by Bappebti. It provides a platform for buying, selling, and investing in crypto assets, focusing on transparency and compliance. It's the first Indonesian exchange to offer licensed on-chain staking with features like Lightning and Pro Mode trading. Co-founded by crypto miners Sumardi Fung and Robby, with Jesse Choi joining later, Reku supports various coins including Bitcoin, Altcoins, and Stablecoins, each vetted through a strict due diligence process. Reku aims to provide a convenient and comprehensive crypto investment experience for users of all levels.",https://s2.coinmarketcap.com/static/img/exchanges/64x64/723.png,https://www.reku.id
http://schema.org,Thing,Remitano,"Remitano aims to bridge fiat-crypto gaps and provide a secure platform for cryptocurrency transactions. The company claims to have served over 3 million users in 50+ countries. Known for positioning itself as a leading on-off ramp service in the blockchain industry, Remitano's mission is to make people ""financially happy"" through innovative solutions. They offer a range of services, including cryptocurrency investment and storage, crypto payments for goods and services, and educational resources about cryptocurrencies. With a focus on addressing global challenges and meeting customer needs through continuous innovation, Remitano remains a key player in the financial technology sector.",https://s2.coinmarketcap.com/static/img/exchanges/64x64/567.png,https://remitano.com/
http://schema.org,Thing,Ripio Trade,"Part of Ripio's innovative blockchain solutions, catering to crypto transactions and market trading.",https://s2.coinmarketcap.com/static/img/exchanges/64x64/1100.png,https://ripio.com/
http://schema.org,Thing,SafeTrade,"SafeTrade, launched in May 2018, is a centralized international cryptocurrency exchange focusing on providing secure and user-friendly crypto trading services. SafeCoin is used as the base pair, offering unique trading opportunities.",https://s2.coinmarketcap.com/static/img/exchanges/64x64/491.png,https://www.safe.trade/
http://schema.org,Thing,Orbix,"Orbix is Thailand's sole regulated digital asset exchange with ISO 27001 and ISO 27701 certifications for security and privacy management. The platform offers low trading fees of 0.2% and a Multiple Network feature for cost-effective, faster transactions. It provides excellent customer support via chat, email, and phone, and is accessible on iOS and Android devices. Orbix is fully regulated by Thailand's SEC, ensuring compliance and user protection in the digital asset trading space.",https://s2.coinmarketcap.com/static/img/exchanges/64x64/325.png,https://www.orbixtrade.com/exchange/
http://schema.org,Thing,SecondBTC,"Launched in June 2018, Secondbtc is a centralized cryptocurrency exchange based in India. The platform offers trading services for various digital assets.",https://s2.coinmarketcap.com/static/img/exchanges/64x64/564.png,https://secondbtc.com/
http://schema.org,Thing,ShibaSwap,"ShibaSwap is a decentralized exchange for the Shiba Inu (SHIB) meme coin, offering liquidity provision, token swapping, staking, and NFT trading. Launched on July 6, 2021, it was developed by the Shiba Inu community to increase SHIB's utility and differentiate it from other meme coins. The exchange's founder, like Shiba Inu's creator 'Ryoshi,' remains anonymous. ShibaSwap supports over 230 markets, including SHIB, LEASH, and BONE tokens. Users pay Ethereum gas fees for transactions. The platform is open worldwide and does not offer leverage or margin trading. ShibaSwap's launch contributed to SHIB briefly surpassing Dogecoin in market capitalization in November 2021.",https://s2.coinmarketcap.com/static/img/exchanges/64x64/1408.png,https://shibaswap.com/#/
http://schema.org,Thing,Sovryn,"Sovryn Protocol is a decentralized exchange for buying, selling, lending and borrowing Bitcoin. The exchange is built on Bitcoin layer 2 RSK protocol for fast, cheap transactions and smart contracts.",https://s2.coinmarketcap.com/static/img/exchanges/64x64/1407.png,https://live.sovryn.app/
http://schema.org,Thing,SpiritSwap,"A decentralized exchange on the Fantom Opera Chain launched in April 2021. It functions as an automated market maker where users provide liquidity by depositing token pairs into pools and earn fees from swaps. Traders can exchange tokens against these liquidity pools. SpiritSwap incentivizes liquidity through yield farming, allowing users to stake SPIRIT-LP tokens to earn SPIRIT tokens. These governance tokens enable participation in the DAO for voting on protocol parameters and development decisions. SPIRIT token holders also benefit from protocol revenue, integrating liquidity provision, trading, governance, and revenue sharing within a decentralized framework on the Fantom blockchain.",https://s2.coinmarketcap.com/static/img/exchanges/64x64/1359.png,https://app.spiritswap.finance/
http://schema.org,Thing,SpookySwap,"A decentralized exchange on the Fantom blockchain, operating as an automated market maker. It allows token swaps, liquidity provision, and yield farming. The platform supports bridging to other blockchains, features an NFT collection, and was launched in April 2021. Offers a 0.2% trading fee for swaps, 0.22% for limit orders, and lacks leverage or margin trading. Supported by the Fantom Foundation.",https://s2.coinmarketcap.com/static/img/exchanges/64x64/1455.png,https://spookyswap.finance
http://schema.org,Thing,StakeCube,"Launched on 13/05/2019, StakeCube Exchange is a centralized exchange based in Germany. It supports currently 7+ base trading pairs (BTC, SCC, LTC, DASH, DOGE, ETH, Stablecoins) with 200+ markets. A unique integration allows users to earn staking rewards and interest for coins in open orders",https://s2.coinmarketcap.com/static/img/exchanges/64x64/863.png,https://stakecube.net/app/exchange/
http://schema.org,Thing,StormGain,"StormGain, launched in July 2019, is a Seychelles-registered centralized platform for trading, exchange, and holding cryptocurrencies. It offers spot and futures trading with leverage up to x300, a free BTC miner, and interest rates up to 12%. The platform provides built-in wallets for various cryptocurrencies, including USDT, BTC, ETH, and others. Users can purchase crypto with credit cards and access demo accounts for practice. StormGain also features in-app trading signals to assist users in making informed decisions. This comprehensive suite of services makes StormGain a versatile option for both novice and experienced crypto traders.",https://s2.coinmarketcap.com/static/img/exchanges/64x64/922.png,https://stormgain.com
http://schema.org,Thing,SWFT Trade,"SWFT Blockchain is a cross-chain wallet, exchange, and payments platform powered by Swftcoin (SWFTC) that allows users to swap, trade, pay with and share cryptocurrencies. SWFT Blockchain operates SWFT Octopus Trade a centralized exchange and exchange aggregator hybrid that allows SWFT Blockchain to place buy and sell orders at competitive rates. Founded in 2017, SWFT Blockchain received investment from Draper Dragon in 2018 and participated in the first batch of the Berkeley Blockchain Xcelerator in 2019.",https://s2.coinmarketcap.com/static/img/exchanges/64x64/945.png,https://www.swft.pro/#/
http://schema.org,Thing,Swop.fi,"Swop.fi is an automated market maker on the Waves blockchain utilizing different pricing formulas for token pairs like a Flat formula for stable coins and Constant Product Market Maker formula for others. It stakes pool liquidity for daily payouts, increasing providers' income by 5-50% APY plus trading fees and rewards them with the SWOP governance token. Built on Waves, it offers fast, low-cost transactions at 0.005 WAVES per contract.",https://s2.coinmarketcap.com/static/img/exchanges/64x64/1297.png,https://swop.fi/
http://schema.org,Thing,Symmetric (Gnosis Chain),"Launched in July 2021, Symmetric is a Decentralized Exchange (DEX) and an Automated Market Maker (AMM) running on the Celo & xDai networks. It was built with skyrocketing gas prices in mind, to make DeFi accessible to everyone. Symmetric is governed by a DAO through its governance token (ticker:SYMM).",https://s2.coinmarketcap.com/static/img/exchanges/64x64/1473.png,https://symmetric.finance
http://schema.org,Thing,TimeX,"TimeX, launched in July 2019, is an Australian hybrid exchange utilizing plasma technology. Licensed by AUSTRAC as a digital exchange provider, TimeX offers various features to enhance user experience and accessibility. These include third-party fiat gateways and a proprietary AUDT stablecoin environment. The latter allows Australian users to directly link their bank accounts for seamless AUD deposits and near-instant withdrawals. This combination of regulatory compliance, advanced technology, and user-friendly features positions TimeX as a notable player in the Australian cryptocurrency exchange market.",https://s2.coinmarketcap.com/static/img/exchanges/64x64/655.png,https://timex.io/
http://schema.org,Thing,Tokenize Xchange,"Tokenize Xchange, a centralized cryptocurrency exchange, was launched in February 2018. It operates in Malaysia and Singapore and has obtained full approval from the Securities Commission Malaysia, cementing its regulatory compliance in the region. The exchange is also pursuing an MPI license in Singapore to enhance its operational capabilities and regulatory stature. This dual-country approach shows its commitment to growing its presence and ensuring adherence to local regulations in the cryptocurrency markets of both countries.",https://s2.coinmarketcap.com/static/img/exchanges/64x64/500.png,https://tokenize.exchange/
http://schema.org,Thing,Tokenlon,"Tokenlon is a decentralized exchange leveraging the 0x protocol to offer secure, reliable, and seamless trading to a wide user base. Its key features include: decentralized architecture ensuring user asset security and control; integration with multiple liquidity sources for competitive pricing; support for various token standards and cross-chain transactions; user-friendly interface with mobile app availability; low transaction fees and fast settlement times; built-in wallet functionality for convenient asset management; advanced trading features like limit orders and stop-loss; compliance with regulatory requirements in supported jurisdictions. Tokenlon aims to bridge the gap between traditional finance and decentralized trading, making it accessible to both experienced crypto traders and newcomers. By combining the benefits of decentralized finance with a user-centric approach, Tokenlon strives to become a leading platform in the evolving cryptocurrency ecosystem.",https://s2.coinmarketcap.com/static/img/exchanges/64x64/856.png,https://tokenlon.im/instant
http://schema.org,Thing,Tokocrypto,"Tokocrypto, launched on April 15, 2018, is a centralized cryptocurrency exchange headquartered in Jakarta, Indonesia. It offers Indonesian Rupiah (IDR) fiat on/off ramps for users. The exchange claims to be the first in Indonesia to obtain official registration (Registration number: 001/BAPPEBTI/CP-AK/11/2019) with the country's Commodity Futures Trading Regulatory Agency (BAPPEBTI). This registration signifies compliance with local regulatory requirements and enhances the platform's credibility in the Indonesian cryptocurrency market.",https://s2.coinmarketcap.com/static/img/exchanges/64x64/710.png,https://www.tokocrypto.com/
http://schema.org,Thing,Tokpie,Tokpie provide a Bounty Stakes Trading solution.,https://s2.coinmarketcap.com/static/img/exchanges/64x64/1250.png,https://tokpie.io/
http://schema.org,Thing,Trader Joe (Avalanche),"Trader Joe is a DeFi platform offering several functions like token swaps via an automated market maker, yield farming, staking of the native utility token, borrowing and lending on the integrated money marketand an NFT marketplace. The platform is built on the Avalanche ecosystem.",https://s2.coinmarketcap.com/static/img/exchanges/64x64/1456.png,https://www.traderjoexyz.com
http://schema.org,Thing,TruBit Pro Exchange,"A global platform offering spot and derivative trading, along with various digital asset financial services intended for professional traders. The exchange has regulatory licenses such as an MSB in the U.S., a VASP in Mexico, and a PSP in Argentina, showcasing their commitment to compliance and high operational standards.",https://s2.coinmarketcap.com/static/img/exchanges/64x64/1133.png,https://www.trubit.com/pro
http://schema.org,Thing,Ubeswap,"A decentralized exchange on the Celo blockchain, utilizing an automated market maker system for efficient trading without traditional order books or centralized intermediaries.",https://s2.coinmarketcap.com/static/img/exchanges/64x64/1339.png,https://ubeswap.org/
http://schema.org,Thing,Unicly,"Unicly is a protocol for combining, fractionalizing, and trading NFTs, built as a fork of Sushiswap. It features a permissionless, community-owned AMM DEX. Users can create uTokens, representing fractional ownership in NFT collections. Unicly currently supports fractionalized versions of popular NFTs like CryptoPunks, Hashmasks, Aavegotchi, and Axies. Any user can fractionalize their NFT collections and list their uTokens on the platform. This innovative approach allows for increased liquidity and accessibility in the NFT market, enabling partial ownership and trading of high-value digital assets.",https://s2.coinmarketcap.com/static/img/exchanges/64x64/1334.png,https://app.unic.ly
http://schema.org,Thing,Uniswap v2,"A decentralized exchange utilizing an automated market maker model to provide continuous liquidity. It implements a ""constant product"" formula. Originated by Hayden Adams in 2018, with V2 launched in August 2020. Known for flash swaps, protocol fees, wrapped Ether, and supporting ERC-20 token swaps. New York City-based, with access restrictions in 10 sanctioned countries. Charges a 0.3% transaction fee per swap, shared with liquidity providers. Not involving leverage or margin trading.",https://s2.coinmarketcap.com/static/img/exchanges/64x64/1069.png,https://uniswap.org/
