@context,@type,name,description,image,url
http://schema.org,Thing,50x,"Launched on 25/10/2018, 50x.com is a centralized exchange registered in Kingstown, Saint Vincent and the Grenadines. 50x.com claims to be the first cryptocurrency exchange with an Any2Any trading core that supports direct trades between all listed coins. Powered by A2A technology with automated liquidity aggregation, 50x.com allows users to trade any listed coin to any other listed coin directly in one trade, with the benefits of the fair open market with trader's tools like stop losses, trailing stops, token loans, and Professional Managed Accounts.",https://s2.coinmarketcap.com/static/img/exchanges/64x64/603.png,https://trade.50x.com/
http://schema.org,Thing,ACDX,"A cryptocurrency derivatives exchange offering spot trading, delta one products, and structured products, launched on September 29, 2020, catering to crypto traders with a comprehensive range of financial instruments. It aims to serve both novice and experienced traders by capitalizing on the growing interest in crypto derivatives.",https://s2.coinmarketcap.com/static/img/exchanges/64x64/1179.png,https://acdx.cash/
http://schema.org,Thing,ACE,"Centralized fiat-currency exchange headquartered in Taipei, Taiwan. Launched on October 11, 2018, it supports New Taiwan Dollar (TWD) fiat pairs and offers services for fiat deposits and withdrawals, as well as facilitating Initial Exchange Offerings (IEOs). Its platform primarily caters to the Taiwanese market and TWD-based crypto transactions.",https://s2.coinmarketcap.com/static/img/exchanges/64x64/741.png,https://www.ace.io/home
http://schema.org,Thing,Alcor,"Since its inception in February 2020, Alcor Exchange has been at the forefront of the decentralized finance (DeFi) movement on the WAX blockchain. Known for its robust and innovative trading solutions, Alcor has become a key player in the DEX landscape.",https://s2.coinmarketcap.com/static/img/exchanges/64x64/1430.png,https://alcor.exchange/
http://schema.org,Thing,ApeSwap (BSC),"ApeSwap is an Automated Market Maker, Yield Farming, and Staking platform on Binance Smart Chain (forked from PancakeSwap).",https://s2.coinmarketcap.com/static/img/exchanges/64x64/1281.png,https://apeswap.finance/#/swap
http://schema.org,Thing,ApeSwap (Polygon),ApeSwap is a leading decentralized exchange (DEX) on Binance Smart Chain and Polygon focused on offering a premier trading experience.,https://s2.coinmarketcap.com/static/img/exchanges/64x64/1466.png,https://apeswap.finance/
http://schema.org,Thing,APX,"APX Finance (APX) is the foremost decentralized exchange (DEX) for crypto derivatives on BNB Chain. Offering both order book (BNB Chain, Ethereum, Arbitrum, zkSync, BASE, Manta) and on-chain perpetuals (BNB Chain, Arbitrum).",https://s2.coinmarketcap.com/static/img/exchanges/64x64/1452.png,https://www.apollox.finance/en
http://schema.org,Thing,APROBIT,"A centralized exchange launched on January 6, 2020, based in the Republic of Korea. It supports trading in Korean Won (KRW) and US Dollar (USD) fiat pairs and allows fiat deposits and withdrawals in KRW.",https://s2.coinmarketcap.com/static/img/exchanges/64x64/1071.png,https://www.aprobit.com/
http://schema.org,Thing,Azbit,"A cryptocurrency exchange launched on December 28, 2019. Advised by Bitcoin.com founder Roger Ver, Azbit offers spot crypto trading, wallets, staking, savings, and Initial Exchange Offerings (IEO). In its three-plus years of operation, Azbit has successfully listed over 400 cryptocurrency projects. The platform aims to bridge the gap between traditional finance and the crypto world, providing a comprehensive suite of services for users to engage with digital assets. With its diverse offerings and ambitious goals, Azbit seeks to establish itself as a significant player in the evolving cryptocurrency ecosystem.",https://s2.coinmarketcap.com/static/img/exchanges/64x64/1117.png,https://azbit.com/exchange
http://schema.org,Thing,BabySwap,"BabySwap is a decentralized exchange (DEX) on the Binance Smart Chain, specializing in newly launched projects. It combines an automated market maker (AMM) with NFT functionality, offering a user-friendly trading environment and enhanced project support. This platform stands out for its focus on emerging projects, providing them with better visibility and resources. BabySwap's unique approach aims to create a more accessible and supportive ecosystem for both new projects and traders in the decentralized finance (DeFi) space.",https://s2.coinmarketcap.com/static/img/exchanges/64x64/1395.png,https://babyswap.finance
http://schema.org,Thing,BakerySwap,"BakerySwap positions itself as an improved version of Uniswap with faster transactions and lower fees. It rewards liquidity providers with BAKE tokens, which earn a portion of trading fees and allow participation in governance decisions, aiming for a more efficient decentralized exchange experience.",https://s2.coinmarketcap.com/static/img/exchanges/64x64/1302.png,https://www.bakeryswap.org/#/home
http://schema.org,Thing,Balanced,"A user-friendly DeFi platform designed for widespread adoption, offering fast, affordable, and easy-to-use services. It provides an optimal experience for users seeking to leverage their cryptocurrency holdings while delivering higher returns compared to traditional banking.",https://s2.coinmarketcap.com/static/img/exchanges/64x64/1428.png,https://stats.balanced.network/
http://schema.org,Thing,Balancer,"Balancer is a decentralized finance (DeFi) protocol that serves multiple functions in the cryptocurrency ecosystem. As a non-custodial portfolio manager, it allows users to maintain control of their assets while optimizing their investment strategies. The protocol also acts as a liquidity provider, facilitating efficient trading of various tokens. Additionally, Balancer functions as a price sensor, helping to determine accurate market prices for digital assets. With the introduction of Balancer V2, the platform has evolved to offer a more versatile and generalized protocol for automated market makers (AMMs), enhancing its capabilities in decentralized trading and liquidity provision.",https://s2.coinmarketcap.com/static/img/exchanges/64x64/1062.png,https://balancer.finance/
http://schema.org,Thing,Balancer v2 (Ethereum),"Balancer is a non-custodial portfolio manager, liquidity provider, and price sensor protocol. Balancer V2 offers a generalized protocol for automated market makers.",https://s2.coinmarketcap.com/static/img/exchanges/64x64/1404.png,https://balancer.fi/
http://schema.org,Thing,BCEX Korea,"Launched on 18/03/2019, BCEX KR is a centralized exchange based in Korea.",https://s2.coinmarketcap.com/static/img/exchanges/64x64/826.png,https://www.bcex.kr
http://schema.org,Thing,Bilaxy,"A centralized cryptocurrency exchange registered in Seychelles, launched in April 2018. Claims to serve hundreds of thousands of traders from over 80 countries worldwide. Emphasizes liquidity for new tokens and offers more than 150 crypto trading pairs. Aims to become a leading global trading platform by providing a wide array of products and services. Prioritizes transparency, reliability, quality execution, and client services to cater to global crypto traders' needs.",https://s2.coinmarketcap.com/static/img/exchanges/64x64/415.png,https://bilaxy.com/
http://schema.org,Thing,Binance,"Binance is the world's largest cryptocurrency exchange, boasting $76 billion daily trading volume and 90 million customers globally. Founded in 2017 by Changpeng Zhao and Yi He, it offers a comprehensive ecosystem including trading, storage, and access to over 350 cryptocurrencies. Binance charges tiered fees, with regular users paying 0.10% for spot trading. The platform supports margin trading with up to 10X leverage and offers derivatives products. While Binance operates globally, it faces restrictions in several countries, including the United States, where a separate platform, Binance.US, was launched in 2019. The company has expanded its services to include ventures like Binance Labs, Launchpad, and NFT marketplace.",https://s2.coinmarketcap.com/static/img/exchanges/64x64/270.png,https://www.binance.com/
http://schema.org,Thing,Binance TR,"A digital asset marketplace launched in September 2020, operated by BN Teknoloji in Istanbul, Turkey. Uses licensed Binance technologies for secure transactions with Turkish Lira, supporting BTC, ETH, and USDT with a 0.1% transaction fee using a Maker-Taker model. Offers spot trading, liquidity features, security through the Binance SAFU fund, and complies with local laws. It does not serve clients in Canada, Japan, or the US.",https://s2.coinmarketcap.com/static/img/exchanges/64x64/1375.png,https://www.trbinance.com/
http://schema.org,Thing,Binance.US,"Binance.US is the U.S.-regulated arm of global cryptocurrency exchange Binance, offering over 120 assets and 60+ trading pairs. Managed independently by BAM Trading Services, it is headquartered in Palo Alto, California.",https://s2.coinmarketcap.com/static/img/exchanges/64x64/630.png,https://www.binance.us/
http://schema.org,Thing,BingX,"Founded in 2018, BingX is a leading global crypto exchange serving over 10 million users worldwide. It offers diverse products including spot, derivatives, copy trading, and asset management. In 2024, BingX became Chelsea FC's principal partner. Founded by Lee, BingX operates globally with offices in multiple continents. The platform supports over 700 cryptocurrencies and trading pairs, with popular assets including BTC, ETH, and XRP. BingX charges a 0.1% handling fee for spot trading and up to 0.05% for futures trading. Users can leverage up to 125 times for crypto futures trading. However, BingX's services are restricted in several countries, including the US, UK, and Canada.",https://s2.coinmarketcap.com/static/img/exchanges/64x64/1064.png,https://www.bingx.com/
http://schema.org,Thing,Birake Exchange,"Launched in Dec 2018, Birake is a decentralized exchange based in Estonia. Birake's mission is to offer both exchange owners and users of Birake exchange the largest database of orders/ users while achieving high trade volumes. Birake aims to connect exchanges from its network and share orders/assets between them.",https://s2.coinmarketcap.com/static/img/exchanges/64x64/503.png,https://birake.com/
http://schema.org,Thing,BIT,"BIT is a full-featured cryptocurrency exchange that is designed for use by professionals. It provides services such as the execution of trading strategies, price discovery, and liquidity provision. BIT is always working to encourage the creation of innovative new financial products, improve the trading tools available to users, and offer a wide variety of tokens. Trade with confidence knowing that the platform is built with institutional-grade security and risk management measures in place.",https://s2.coinmarketcap.com/static/img/exchanges/64x64/1161.png,https://www.bit.com
http://schema.org,Thing,Bitazza,"Established in 2018, Bitazza is a centralized digital asset platform licensed by Thailand's SEC and Ministry of Finance, offering institutional-grade services, including smart routing of domestic orders to international markets with high liquidity. The ecosystem features a utility token, fiat-backed stablecoin, Visa card, and blockchain-based payment solution. It provides services such as instant fiat deposits and withdrawals, fiat and crypto trading pairs, and OTC services, catering to both retail and institutional investors.",https://s2.coinmarketcap.com/static/img/exchanges/64x64/1124.png,https://www.bitazza.com/
http://schema.org,Thing,Bitbns,"Founded in December 2017 by three partners. Rapidly became one of India's largest cryptocurrency trading platforms. Attracted over 500,000 users within its first year. Pioneered Bracket Orders in crypto trading. Offers advanced features like Margin Trading, Stop Limit, and Trailing Stop Limit. First Indian exchange to list more than 50 cryptocurrencies within a year of launch. Provides a P2P FIAT deposit and withdrawal system.",https://s2.coinmarketcap.com/static/img/exchanges/64x64/376.png,https://bitbns.com/
http://schema.org,Thing,Bitci TR,"Bitci TR, a centralized exchange founded in Turkey in 2018, boasts over 5 million registered users. The platform facilitates 24/7 Turkish Lira deposits and withdrawals through partnerships with seven Turkish banks. Bitci TR's current offering includes trading pairs with Turkish Lira and USDT. This exchange caters primarily to the Turkish market, providing a seamless interface between traditional banking and cryptocurrency trading.",https://s2.coinmarketcap.com/static/img/exchanges/64x64/594.png,https://www.bitci.com.tr/
http://schema.org,Thing,FMFW.io,"FMFW.io aims to empower global cryptocurrency trading for all skill levels. The platform offers over 400 trading pairs, high liquidity, and 24/7 multilingual support. Key features include cutting-edge matching engine technologies, up to 12x leverage for 29+ markets, a user-friendly terminal, tight spreads, and regular trading competitions. FMFW.io prioritizes security while providing an attractive platform for both novice and professional traders. The company's mission, reflected in its name 'Free the Money, Free the World,' is to facilitate easy and confident cryptocurrency trading worldwide.",https://s2.coinmarketcap.com/static/img/exchanges/64x64/857.png,https://fmfw.io/
http://schema.org,Thing,Bitcoiva,"Launched in June 2020, Bitcoiva is a fast-growing Indian crypto-trading platform that supports various transaction types. Distinctive features include instant INR withdrawals/deposits, high liquidity, and a simple user interface. Security is prioritized through KYC verification and it is accessible via a mobile app, offering 24/7 customer support. Bitcoiva also maintains a strong online presence and provides blog content for users.",https://s2.coinmarketcap.com/static/img/exchanges/64x64/1131.png,https://www.bitcoiva.com/markets
http://schema.org,Thing,Bitexen,"Bitexen is a centralized cryptocurrency exchange based in Istanbul, Turkey. It launched on May 4, 2018, and has over 2 million estimated users. The exchange provides fiat on-off ramps for Turkish Lira and offers instant and pro trading features, along with 24/7 customer support. It uses its native token, BTXN, for lower fees and additional privileges. Designed for both novice and veteran traders, Bitexen offers a blend of services to cater to varied cryptocurrency trading demands in the Turkish market.",https://s2.coinmarketcap.com/static/img/exchanges/64x64/1138.png,https://www.bitexen.com/
http://schema.org,Thing,BITEXLIVE,"BITEXLIVE is a centralized cryptocurrency exchange that began operations on June 30, 2017. The platform is headquartered in Uralsk, a city in the West Kazakhstan Region of Kazakhstan. Specifically, its address is located at House No. 174 on K. Amanzokolev Street, with a postal code of 090000. As a centralized exchange, BITEXLIVE likely offers a range of cryptocurrency trading services, including buying, selling, and potentially trading various digital assets. The exchange's location in Kazakhstan may influence its regulatory environment and user base.",https://s2.coinmarketcap.com/static/img/exchanges/64x64/653.png,https://bitexlive.com/
http://schema.org,Thing,Bitfinex,"Bitfinex, founded in 2012, is a cryptocurrency exchange operated by iFinex Inc., based in Hong Kong. It caters to professional traders and institutions, offering fiat and crypto support, high liquidity for major cryptocurrencies, and advanced security features. Bitfinex provides various trading options, including margin trading, OTC, and derivatives. It supports over 270 cryptocurrencies and provides competitive fees with discounts for UNUS SED LEO token holders. Qualified users can trade with up to 10X leverage. Bitfinex restricts access to several countries, including the U.S., Canada, and certain regions. The platform's co-founders are Raphael Nicolle and Giancarlo Devasini, with the latter serving as CFO.",https://s2.coinmarketcap.com/static/img/exchanges/64x64/37.png,https://www.bitfinex.com
http://schema.org,Thing,bitFlyer,"bitFlyer is a Japanese crypto exchange with over 3 million users worldwide and €180 billion in global trading volume in 2021. Licensed in the EU, US, and Japan, it offers simple and advanced trading interfaces, spot and margin trading, crypto derivatives, and fast transactions. Founded in 2014 by former Goldman Sachs employees, bitFlyer is headquartered in Tokyo with a US subsidiary in San Francisco. The platform supports 11 digital assets, including popular cryptocurrencies like BTC, ETH, and LTC. Trading fees range from 0.1% to 0.2%, with some free trading options available. bitFlyer offers up to 2X leverage for margin trading on certain products, with potentially higher limits for corporate accounts.",https://s2.coinmarketcap.com/static/img/exchanges/64x64/139.png,https://bitflyer.com/en-us/
http://schema.org,Thing,Bitget,"Seychelles-based cryptocurrency exchange serving over 20 million users in 100+ countries, providing services including spot, futures, margin trading, copy trading, and AI tools. Supports over 500 crypto tokens and 500+ trading pairs. Founded in 2018 and led by CEO Sandra Lou and Managing Director Gracy Chen. Offers leverage trading up to 125x for futures and 10x for spot. Provides competitive trading fees with discounts for BGB holders and VIP members. Recently rebranded with the philosophy 'Trade smarter'.",https://s2.coinmarketcap.com/static/img/exchanges/64x64/513.png,https://www.bitget.com
http://schema.org,Thing,BitHash,"A centralized cryptocurrency exchange based in Singapore, launched on June 23, 2016. Operated by PHOENIX TRADING SOLUTIONS LTD, a company incorporated in the Republic of Seychelles under the International Business Companies Act of 2016. It offers fiat deposits and withdrawals in USD, EUR, and RUB, OTC trading services, and an IEO launchpad platform.",https://s2.coinmarketcap.com/static/img/exchanges/64x64/843.png,https://www.bithash.net/
http://schema.org,Thing,Bithumb,"Bithumb is a major South Korean crypto exchange with $205 million daily trading volume and 170+ listed cryptocurrencies. It offers bot trading, institutional accounts, liquidity access, passive income options, and 24/7 support. While unregulated, Bithumb is working towards compliance with international financial regulators. The platform requires account registration and implements security measures like OTP verification and AML checks. Founded in 2013 as Xcoin and rebranded in 2015, Bithumb aims to become a global blockchain-based financial corporation. The exchange supports 180+ digital assets and 280+ trading pairs, with transaction fees ranging from 0.04% to 0.25%. Bithumb does not offer leverage or margin trading.",https://s2.coinmarketcap.com/static/img/exchanges/64x64/200.png,https://www.bithumb.com/
http://schema.org,Thing,Bitkub,"Founded in February 2018, Bitkub is Thailand's leading digital asset and cryptocurrency exchange platform. It holds a license from the Thai SEC and operates with a registered capital of 450 million baht. The company is based in Bangkok and offers an array of services including cryptocurrency buying, selling, and storage. It supports Thai market traders, provides liquidity, and facilitates THB trade pairs for digital assets. Accessible via Android and iOS, Bitkub.com aims to cater to non-tech users by offering a user-friendly platform with features like multi-cryptocurrency wallets, technical analysis tools, and various cash-out options for businesses. Bitkub's mission is to be the most trusted and user-friendly cryptocurrency exchange in Thailand.",https://s2.coinmarketcap.com/static/img/exchanges/64x64/436.png,https://www.bitkub.com/
http://schema.org,Thing,BitMart,"BitMart is a centralized cryptocurrency exchange serving over 9 million users worldwide. It offers trading and investment services, including spot and futures trading, staking, lending, and margin trading with leverage. The platform supports 1000+ crypto assets with 700+ trading pairs, and provides a user-friendly interface, mobile app, and NFT marketplace. Founded in 2017 by Sheldon Xia and headquartered in the Cayman Islands, BitMart operates in over 180 countries but restricts access to certain regions. The exchange uses a tiered fee structure with a maker-taker model, starting at 0.25% for both makers and takers. The native token, BMX, was launched in 2018.",https://s2.coinmarketcap.com/static/img/exchanges/64x64/406.png,https://bitmart.com
http://schema.org,Thing,BitMEX,"BitMEX is a P2P cryptocurrency exchange and derivatives trading platform founded in 2014, registered in Seychelles. It caters to advanced investors, offering leveraged tokens and margin trading. Key features include deep liquidity for Bitcoin perpetuals, professional trading dashboard, low fees, and cold storage security. The platform supports various cryptocurrencies for futures/perpetual contracts. Trading fees start at 0.025%, with no deposit or withdrawal fees. BitMEX offers up to 100x leverage on some products, with isolated and cross-margin trading options. The exchange is not available to U.S. residents and several other restricted countries. BitMEX was co-founded by Arthur Hayes, Samuel Reed, and Ben Delo, with a focus on advanced trading features and security.",https://s2.coinmarketcap.com/static/img/exchanges/64x64/157.png,https://www.bitmex.com/
http://schema.org,Thing,Bitonic,"Launched in 2013, BL3P is a product of Bitonic, a Dutch Bitcoin company founded in 2012. The exchange is available in all European countries. BL3P holds a Dutch bank account to process Euro transactions. BL3P is a fiat on-ramp for the Euro. European users can deposit and withdrawal Euro's through SEPA. Dutch users can deposit Euros through iDEAL and SEPA. The exchange has a fixed fee of 0,25% for both limit and market orders.",https://s2.coinmarketcap.com/static/img/exchanges/64x64/96.png,https://bitonic.nl
http://schema.org,Thing,BitoPro,"BitoPro is a centralized cryptocurrency exchange founded in Taiwan in March 2018. The platform offers trading pairs with the New Taiwan Dollar (TWD), providing local users with direct fiat-to-crypto trading options. As a centralized exchange, BitoPro likely offers features such as custodial wallet services, order matching, and compliance with local regulations. Its focus on TWD pairs suggests a primary target audience of Taiwanese crypto traders and investors.",https://s2.coinmarketcap.com/static/img/exchanges/64x64/717.png,https://www.bitopro.com/
http://schema.org,Thing,Bitrue,"Launched in July 2018, Bitrue is a top cryptocurrency exchange known for offering access to over 700 cryptocurrencies. The platform provides various services, including spot trading, futures, OTC, staking, copy trading, and more. It ranks highly in global trading volume, especially for XRP. Users can trade a wide range of cryptocurrency pairs, ETFs, and explore staking options offering up to 55% APR. It supports major cryptocurrencies such as BTC, ETH, XRP, and SOL, alongside fiat-to-crypto and crypto swapping services. The trading fees are between 0.098% and 0.28%, with potential discounts when using BTR, Bitrue's native currency. The platform also supports leverage trading and offers crypto derivative contracts, with a strong emphasis on security and customer protection.",https://s2.coinmarketcap.com/static/img/exchanges/64x64/433.png,https://www.bitrue.com/
http://schema.org,Thing,Bitso,"Bitso, founded in 2014, is Latin America's first regulated cryptocurrency platform with over 6 million global users. It offers a mobile app for buying, selling, and using cryptocurrencies, and Bitso Alpha, a high-liquidity exchange with advanced trading tools. Serving both institutional and retail clients, Bitso supports multiple currencies for on/off-ramps and on/off-books trading. Users can access the platform through Bitso Alpha or API, enabling complex automated trading strategies. Bitso lists 47 cryptocurrencies, including major coins like Bitcoin, Ethereum, and Ripple, as well as stablecoins and tokens.",https://s2.coinmarketcap.com/static/img/exchanges/64x64/125.png,https://bitso.com
http://schema.org,Thing,Bitspay,"A centralized cryptocurrency exchange launched in Estonia in January 2020. It is regulated under Estonia's Anti Money Laundering Counter-Terrorism Financing Act 2019. The platform emphasizes trust, security, and a pro-regulation stance, providing services to users from over 30 countries with a focus on Australia, New Zealand, and Singapore. Customers include individuals, businesses, trusts, and Self-Managed Superannuation Funds, with mandatory KYC procedures and tiered trading fees.",https://s2.coinmarketcap.com/static/img/exchanges/64x64/961.png,https://www.bitspay.io/
http://schema.org,Thing,Bitstamp,"Founded in 2011, Bitstamp is a regulation-centered, centralized crypto exchange expanded across more than 100 countries and serving over 4 million customers. With its operations on web, mobile, and API platforms, it avails trading access to 80 digital assets. Security remains a primary concern with 95% of crypto stored offline and 50 global licenses attained. Educational resources and 24/7 customer support further strengthen their offerings. Originally established in Slovenia by Damian Merlak and Nejc Kodrič, current leadership consists of seven compliance-focused professionals. Bitstamp accommodates prominent cryptocurrencies including BTC, ETH, and USDT utilizing a maker-taker fee structure adjusted according to 30-day trading volumes. Notably, it does not support leverage or margin trading.",https://s2.coinmarketcap.com/static/img/exchanges/64x64/70.png,https://www.bitstamp.net
